{
  "schemaVersion": 1,
  "artifactKind": "dependency_advisory_snapshot",
  "snapshotId": "zod-4.6.7-zero-advisories",
  "generatedAt": "2026-10-30T13:10:12.914Z",
  "scanner": {
    "identity": "pnpm-audit",
    "version": "pnpm@11.1.3",
    "status": "complete",
    "command": "pnpm --config.registry=https://registry.npmjs.org audit --prod --audit-level=moderate --json"
  },
  "lockfiles": {
    "pnpm-lock.yaml": {
      "present": true,
      "sha256": "a07dfe48a4dabde19df1cfd97c84e4dcad34c9d50ee6a3175c0fed910aaa4261"
    },
    "vendor/magic-context/bun.lock": {
      "present": true,
      "sha256": "5f8b0c7089743ea645277846664bfdeab59115ad8919048204ccc963047301ef"
    },
    "integrations/stardew/packages.lock.json": {
      "present": true,
      "sha256": "7b2b7f4f8325e4a144e8a73b6dbc805a499940be6204d7d5f6ccb8e0e64ec660"
    }
  },
  "advisories": []
}
